{
  "schema_version": "1.0.0",
  "workflow_id": "giwi-oxygen-calibration-software-fixture",
  "claim_boundary": "This records software fixture and simulation outputs only. It is not a biological experiment, a measured protocol result, a physical pump calibration, or evidence of tissue oxygen exposure.",
  "steps": [
    {
      "step_id": "protocol-constraints",
      "tool_repository": "cell-protocol-compiler",
      "tool_revision": "0e793092150875810f424c3bfc2a0ed7ce9a9054",
      "purpose": "Export source-cited GiWi windows for checking a software candidate table.",
      "execution_status": "completed",
      "input_artifacts": [],
      "output_artifacts": [
        "giwi-constraints"
      ],
      "notes": "Compiled constraints export from protocolcompiler.cli; no culture protocol executed."
    },
    {
      "step_id": "media-import-and-planner",
      "tool_repository": "diffmedia-loop",
      "tool_revision": "cf88ea7d2fa55ff90ce09a85bbaf222ec8869363",
      "purpose": "Aggregate explicitly synthetic wells and preview a constrained planner proposal.",
      "execution_status": "completed",
      "input_artifacts": [
        "giwi-constraints",
        "synthetic-candidates",
        "synthetic-wells"
      ],
      "output_artifacts": [
        "synthetic-observations",
        "synthetic-measurement-report",
        "synthetic-planner-proposal"
      ],
      "notes": "The supplied measurements are generated example data. Planner response is not a cell assay result."
    },
    {
      "step_id": "oxygen-solver",
      "tool_repository": "organoid-oxygen-lab",
      "tool_revision": "a8057adfe31cdf5985107786af4322362e9bc407",
      "purpose": "Run the transient oxygen solver using the checked-in illustrative demo parameter file.",
      "execution_status": "completed",
      "input_artifacts": [
        "oxygen-parameters"
      ],
      "output_artifacts": [
        "oxygen-summary",
        "oxygen-profile"
      ],
      "notes": "Parameters are illustrative, not estimated from tissue uptake or pump flow."
    },
    {
      "step_id": "calibration-analysis",
      "tool_repository": "perfusion-calibration-lab",
      "tool_revision": "9da137cd151d44d394951e6bccf41ca2709e3fc8",
      "purpose": "Analyze the checked-in deterministic synthetic gravimetric trace as a software fixture.",
      "execution_status": "completed",
      "input_artifacts": [
        "synthetic-calibration-input"
      ],
      "output_artifacts": [
        "synthetic-calibration-report"
      ],
      "notes": "The synthetic report demonstrates software behavior and is not a physical calibration record."
    }
  ],
  "artifacts": [
    {
      "artifact_id": "giwi-constraints",
      "repository": "diffmedia-loop",
      "path": "examples/planner-constraints.json",
      "sha256": "e56854f22d0764a6dcdd783f9c8a5058246ea2b70372e8d7c21abbce43eea774",
      "size_bytes": 4226,
      "artifact_kind": "protocol_constraints",
      "evidence_status": "software_fixture",
      "notes": "Checked-in bundled GiWi and dual-SMAD constraint exports; the GIWI protocol compiler's generated standalone file is byte-equivalent only by JSON meaning, not byte-for-byte with this bundle."
    },
    {
      "artifact_id": "synthetic-candidates",
      "repository": "diffmedia-loop",
      "path": "examples/candidates-constrained.csv",
      "sha256": "838cbfd710c9971eff73ef1c6b5b29e09211a89a04e3f65edd4ddd3e22de0daf",
      "size_bytes": 138,
      "artifact_kind": "candidate_fixture",
      "evidence_status": "software_fixture",
      "notes": "Synthetic candidate rows checked against the published windows; not an experimental design recommendation."
    },
    {
      "artifact_id": "synthetic-wells",
      "repository": "regen-workbench",
      "path": "studies/simulation-toolchain/raw_measurements.csv",
      "sha256": "09033095e246adc0107c771365416b0ea74bfc5ace72b1caa77c57a776d3ce38",
      "size_bytes": 1210,
      "artifact_kind": "well_measurement_fixture",
      "evidence_status": "synthetic_input",
      "notes": "Explicitly synthetic sample measurements for exercising the aggregation contract."
    },
    {
      "artifact_id": "synthetic-observations",
      "repository": "regen-workbench",
      "path": "studies/simulation-toolchain/synthetic-observations.csv",
      "sha256": "6f5fc69e0b90f2fd02918c4f3d2d482fa8f98383e0c681c2c84f558f71e04ed8",
      "size_bytes": 1240,
      "artifact_kind": "planner_observations",
      "evidence_status": "synthetic_input",
      "notes": "Generated by diffmedia-loop measurement import; includes hashes and declared endpoint metadata."
    },
    {
      "artifact_id": "synthetic-measurement-report",
      "repository": "regen-workbench",
      "path": "studies/simulation-toolchain/synthetic-measurement-report.json",
      "sha256": "41e1138c60ebc2bd57ff26d27c362a6e73f635c96e01db59f04b17d2c966cb79",
      "size_bytes": 3136,
      "artifact_kind": "measurement_aggregation",
      "evidence_status": "synthetic_input",
      "notes": "Importer audit record; no actual assay data."
    },
    {
      "artifact_id": "synthetic-planner-proposal",
      "repository": "regen-workbench",
      "path": "studies/simulation-toolchain/synthetic-planner-proposal.json",
      "sha256": "9e2357dcca955a73962a3a50870085c9a0817611d7541e46cbe9774473ab68fd",
      "size_bytes": 2763,
      "artifact_kind": "planner_proposal",
      "evidence_status": "software_fixture",
      "notes": "Constrained Gaussian-process proposal over a synthetic fixture response."
    },
    {
      "artifact_id": "oxygen-parameters",
      "repository": "organoid-oxygen-lab",
      "path": "examples/demo/parameters.json",
      "sha256": "74ab6e080530312db4004b800051e8dbb9349b06c1acc7e4caac6bb71e189f29",
      "size_bytes": 233,
      "artifact_kind": "oxygen_parameters",
      "evidence_status": "software_fixture",
      "notes": "Checked-in illustrative solver parameters; vmax is not a measured uptake rate."
    },
    {
      "artifact_id": "oxygen-summary",
      "repository": "regen-workbench",
      "path": "studies/simulation-toolchain/oxygen-summary.json",
      "sha256": "e18c25ecc57819e01cd9a08c41dd5d1fd59ed3165cf12b1251d269c04769e1cc",
      "size_bytes": 2038,
      "artifact_kind": "oxygen_simulation",
      "evidence_status": "simulated",
      "notes": "Oxygen solver output from the illustrative parameter file and declared time grid."
    },
    {
      "artifact_id": "oxygen-profile",
      "repository": "regen-workbench",
      "path": "studies/simulation-toolchain/oxygen-profile.csv",
      "sha256": "0d221614565b137aadf05c4345f6a988bda40363d21cb661c839cc5590ef15f3",
      "size_bytes": 968,
      "artifact_kind": "oxygen_simulation",
      "evidence_status": "simulated",
      "notes": "Transient oxygen time course; no biological measurement."
    },
    {
      "artifact_id": "synthetic-calibration-input",
      "repository": "perfusion-calibration-lab",
      "path": "examples/synthetic_measurements.csv",
      "sha256": "0878d191bc76b93435b2e5a337fd62f9cb3c641d0ce25ca6fef0034d6dc7a030",
      "size_bytes": 18978,
      "artifact_kind": "synthetic_calibration_input",
      "evidence_status": "synthetic_input",
      "notes": "Checked-in deterministic synthetic traces."
    },
    {
      "artifact_id": "synthetic-calibration-report",
      "repository": "regen-workbench",
      "path": "studies/simulation-toolchain/synthetic-calibration-report.json",
      "sha256": "5009371ff660a8460a89f73fa4aabdcbee2fecdc2244464cd84029c1b5224697",
      "size_bytes": 18926,
      "artifact_kind": "synthetic_calibration_report",
      "evidence_status": "synthetic_input",
      "notes": "Output from synthetic traces; explicitly not physical calibration evidence."
    }
  ],
  "limitations": [
    "No cell, organoid, vessel, animal, or human experiment was run.",
    "The planner operates on synthetic values and its output is not a proposed wet-lab condition.",
    "Oxygen model parameters are illustrative and were not estimated from tissue measurements.",
    "The calibration input is synthetic and cannot validate any pump or fluid path.",
    "No inference about regeneration, rejuvenation, efficacy, or safety is supported."
  ]
}
